index	biography	name	fullName
1236	CUMMING GORDON, ALEXANDER PENROSE (1749-1806) of Altyre and Gordonstoun, Elgin, e. s. of Alexander Cumming of Rosehill and Penrose, Corn.; m. 1773 Helen Grant; suc. fa. 1761; suc. gt.-uncle 1775 to Altyre and suc. cos. 1795 to Gordonstown, taking additional name of Gordon; ensign 13 Ft. 1768-74; MP 1802-3; cr. Bt. 1804.	CUMMING GORDON, ALEXANDER PENROSE	Alexander Penrose Cumming Gordon
1237	CUNDILL, see Sir Charles Kemys	CUNDILL	Cundill
1238	CUNINGHAM, DR, see James, Lord Johnston	CUNINGHAM, DR	Dr Cuningham
1239	CUNINGHAME, DAVID	CUNINGHAME, DAVID	David Cuninghame
1240	CUNNINGHAM, ALEXANDER (1654-1737), historian and diplomat, s. of Rev. Alexander Cunningham, minister of Ettrick, Selkirk; Leiden U.; res. Venice 1715-19.	CUNNINGHAM, ALEXANDER	Alexander Cunningham
1241	CUNNINGHAM, EDWARD FRANCIS (c.1741-1793), painter, b. Kelso, Scotland, of a Jacobite family; taken to Italy 1745; later worked in Paris, St Petersburg and Berlin; d. Berlin.	CUNNINGHAM, EDWARD FRANCIS	Edward Francis Cunningham
1242	CUNNINGHAM, WILLIAM (d. 1759); army officer, maj. 1755, lt.col. 1756.	CUNNINGHAM, WILLIAM	William Cunningham
1243	CUNNINGHAM, COL., possibly James Cuninghame, c.1731-88, MP 1786-8, lt.-col. 1758, or Robert Cuninghame, c.1728-1801, MP 1788-9, col. 1762, cr. B. Rossmore [I] 1796.	CUNNINGHAM, COL., possibly James Cuninghame, c.1731-88, MP 1786-8, lt.-col. 1758, or Robert Cuninghame, c.1728-1801, MP 1788-9, col. 1762, cr. B. Rossmore [I] 1796.	Col. Cunningham
1244	CUNNINGHAM	CUNNINGHAM	Cunningham
1245	CUNYNGHAM, ALEXANDER (1703-85), physician of Prestonfield, 3rd s. of Sir William Cunyngham of Caprington; Edinburgh and Leiden U. 1725 and St Andrews 1727; MD 1725; FRCP, Edin. 1727; changed name to Dick and suc. bro. 1746 as 3rd Bt.; m. 1 1736 Janet Dick of Clermiston (d. 1760), 2 1762 Mary Butler.	CUNYNGHAM, ALEXANDER	Alexander Cunyngham
1246	CUNYNGHAM, EDWARD	CUNYNGHAM, EDWARD	Edward Cunyngham
1247	CUNYNGHAME, SIR JAMES (c.1685-1747) of Milncraig, Ayr, and Livingstone, Linlithgow, 1st s. of Sir David Cunynghame; suc. fa. 1708 as 2nd Bt.; MP 1715-22; unm.	CUNYNGHAME, SIR JAMES	Sir James Cunynghame
1248	CUNYNGHAME, SIR WILLIAM AUGUSTUS (1747-1828), o. surv. s. of Lt.-Gen. Sir David Cunynghame, 3rd Bt. of Livingstone, Linlithgow and Milncraig, Ayr.; Ch.Ch. Oxf. 1766; suc. fa. 1767 as 4th Bt.; m. 1 1768 Frances Myreton (d. 1771), 2 1785 Maria Udny; MP 1774-90.	CUNYNGHAME, SIR WILLIAM AUGUSTUS	Sir William Augustus Cunynghame
1249	CURRY, ANNE, see Mrs Anne Renner	CURRY, ANNE	Anne Curry
1250	CURRY	CURRY	Curry
1251	CURTIS, SIR ROGER (1746-1816), naval commander, s. of Roger Curtis of Downton, Wilts; joined navy 1762, lt. 1771, adml. 1804; Kt. 1782; see Lt.-gen.Robert Boyd.	CURTIS, SIR ROGER	Sir Roger Curtis
1252	CURTIS	CURTIS	Curtis
1253	CURZON	CURZON	Curzon
1254	CUTHBERT, JOHN, of Dublin.	CUTHBERT, JOHN, of Dublin.	John Cuthbert
1255	CUTHBERT, possibly John Cuthbert, 1731-82, of Witton Castle, Durham, FRS, FSA, to whom Piranesi dedicated a plate in Vasi, Candelabri, Cippi [1778].	CUTHBERT, possibly John Cuthbert, 1731-82, of Witton Castle, Durham, FRS, FSA, to whom Piranesi dedicated a plate in Vasi, Candelabri, Cippi [1778].	Cuthbert
1256	CUTLER, CHARLES, merchant.	CUTLER, CHARLES, merchant.	Charles Cutler
1257	CUTLER	CUTLER	Cutler
1258	CUZZENS	CUZZENS	Cuzzens
1259	DACRE, 17TH BARON, see Thomas Barrett	DACRE, 17TH BARON	17th Baron Dacre
1260	DACRE, 20TH BARON, see Thomas Brand (1774-1851)	DACRE, 20TH BARON	20th Baron Dacre
1261	DAER, JOHN DOUGLAS, LORD (1765-97), 3rd s. of 4th E. of Selkirk [S]; sty. Ld. Daer 1794-; unm.; d. Florence.	DAER, JOHN DOUGLAS, LORD	John Douglas, Lord Daer
1262	DAGNIA, JAMES (c.1709-55), glassblower and painter, 1st surv. s. of John Dagnia of Cleadon Hall, Northumb.	DAGNIA, JAMES	James Dagnia
1263	DALKEITH, CHARLES WILLIAM HENRY MONTAGU SCOTT, EARL OF (1772-1819), 1st surv. s. of 3rd D. of Buccleuch [S]]; sty. E. of Dalkeith -1812 when suc. fa. as 4th D.; educ. Eton; MP 1793-1807; army officer, capt. 1794, col. 1798; m. 1795 Hon. Harriet Catherine Townshend, dau. of 1st Vct. Sydney; KT 1812.	DALKEITH, CHARLES WILLIAM HENRY MONTAGU SCOTT, EARL OF	Charles William Henry Montagu Scott, Earl Of Dalkeith
1264	DALKEITH, FRANCIS SCOTT, EARL OF (1695-1751), s. and h. of James Scott, sty. E. of Dalkeith; sty. E. of Dalkeith 1705-32 when suc. gd.-fa. as 2nd D. of Buccleuch [S]; m. 1 1720 Ldy. Jean Douglas (d. 1729), dau. of 2nd D. of Queensberry [S], 2 1744 Alice Powell; FRS 1724; KT 1725.	DALKEITH, FRANCIS SCOTT, EARL OF	Francis Scott, Earl Of Dalkeith
1265	DALL, ROBERT, see James, 5th Earl of Southesk	DALL, ROBERT	Robert Dall
1266	DALLAWAY, JAMES (1763-1834), miscellaneous writer, o. s. of James Dallaway, banker of Stroud, Glos; Trin. Oxf., BA 1782; FSA 1789; m. 1800 Harriet Anne Jefferies; sec. to D. of Norfolk, 1799-d.; pub. Constantinople, Ancient and Modern ... [1797] and Anecdotes of the Arts in England [1800].	DALLAWAY, JAMES	James Dallaway
1267	DALNAY	DALNAY	Dalnay
1268	DALRYMPLE, GEORGE, possibly George Dalrymple, d. before 1760, s. of Sir David Dalrymple of Hailes, Haddington; yr. bro. of James Dalrymple.	DALRYMPLE, GEORGE, possibly George Dalrymple, d. before 1760, s. of Sir David Dalrymple of Hailes, Haddington	George Dalrymple
1269	DALRYMPLE, SIR HEW, 2ND BT. (1712-90), 1st. s. of Sir Robert Dalrymple of Castleton; Leiden U. 1731; suc. gd.-fa. 1737 as 2nd Bt.; MP 1742-68; m. 1 1743 Margaret Sainthill (d. 1748), 2 1756 Martha Edwin.	DALRYMPLE, SIR HEW, 2ND BT.	Sir Hew, 2nd Bt. Dalrymple
1270	DALRYMPLE, JAMES (1692-1751), e. s. of Sir David Dalrymple of Hailes, Haddington; Queen's Oxf. 1708; suc. fa. 1721 as 2nd Bt.; MP 1722-34; m. 1725 Ldy. Christian Hamilton, dau. of 6th E. of Haddington [S].	DALRYMPLE, JAMES	James Dalrymple
1271	DALRYMPLE, HON. JOHN (1673-1747), 2nd s. of 1st E. of Stair [S]; Edinburgh and Leiden U.; sty. Master of Stair 1695-1703, Ld. Dalrymple 1703-7 when suc. fa. as 2nd E.; army officer, maj.-gen. 1709, FM 1742; env. extra. Poland 1709-10; amb. Paris 1715-20 and The Hague 1742-3; KT 1710; m. 1714 Ldy. Eleanor Campbell, dau. of 2nd E. of Loudon [S] and wid. of 1st Vct. Primrose.	DALRYMPLE, HON. JOHN	Hon. John Dalrymple
1272	DALRYMPLE, JOHN DALRYMPLE, VISCOUNT (1749-1821), o. s. of 5th E. of Stair [S]; educ. Eton and Edinburgh U.; sty. Vct. Dalrymple 1768-89 when suc. fa. as 6th E.; army officer, capt. 87 Ft. 1779; min.plen. to Poland 1782-4; env.extra. Berlin 1785-7; unm.	DALRYMPLE, JOHN DALRYMPLE, VISCOUNT	John Dalrymple, Viscount Dalrymple
1273	DALRYMPLE, WILLIAM (d. 1807), 2nd s. of Hon. George Dalrymple (3rd s. of the 1st E. of Stair [S]); m. 1783 Marianne Dorothy Harland; army officer, gen.; lt.-gov. of Chelsea Hosp.	DALRYMPLE, WILLIAM	William Dalrymple
1274	DALRYMPLE, COL., possibly Sir Hew Whitefoord Dalrymple, 1750-1830, lt.-col. 1781.	DALRYMPLE, COL., possibly Sir Hew Whitefoord Dalrymple, 1750-1830, lt.-col. 1781.	Col. Dalrymple
1275	DALTON, RICHARD	DALTON, RICHARD	Richard Dalton
1276	DALTON, RICHARD (1713?-91), artist, antiquarian and dealer, s. of Rev. John Dalton of Darlington, Durham; m. 1764 Esther de Heulle [Hull] (d. 1782); lib. to the P. of Wales 1755-60, to K. George III 1760-91, surveyor of the King's Pictures 1778-91, antiquary to the RA 1770-84.	DALTON, RICHARD	Richard Dalton
1277	DALTON, possibly John Houghton Dalton, Catholic family of of Thurnham Hall, Lancs; attainted in 1716; m. Frances Mostyn.	DALTON, possibly John Houghton Dalton, Catholic family of of Thurnham Hall, Lancs	Dalton
1278	DALTON	DALTON	Dalton
1279	DAMER, ANNE (SEYMOUR CONWAY) (1748-1828), sculptor, dau. and h. of Gen. Hon. Henry Seymour Conway and Ldy. Caroline Campbell (dau. of 4th D. of Argyll [S]); m. 1767 Hon. John Damer; exh. RA 1784-5, 1787-90, and between 1795 and 1818; inherited 1797 Strawberry Hill which she released in 1811 to Ld. Waldegrave.	DAMER, ANNE	Anne Damer
1280	DAMER, GEORGE (1727-52), 3rd s. of Joseph Damer of Winterbourne Came, Dorset; army officer, ensign Ft Gds. 1745, capt. 1749, ret.1751; MP 1751-2; unm.	DAMER, GEORGE	George Damer
1281	DAMER, HON. GEORGE (1746-1808), 2nd s. of 1st B. Milton [I] (cr. E. of Dorchester 1792); educ. Eton and Trin. Camb. 1763; MP 1768-74, 1778-98, 1795-7 [I]; sty. Vct. Milton 1792-8 when suc. fa. as 2nd E.; unm.; see John Damer.	DAMER, HON. GEORGE	Hon. George Damer
1282	DAMER, HON. JOHN (1744-76), 1st s. of 1st B. Milton [I] (cr. E. of Dorchester 1792); educ. Eton and Trin. Camb. 1762; m. 1767 Anne Seymour Conway; MP 1768-74; declined election to the Dilettanti 1768; took his own life.	DAMER, HON. JOHN	Hon. John Damer
1283	DAMER, JOSEPH (1718-98), e. s. of Joseph Damer of Winterbourne Came, Dorset; Trin. Dublin 1734; m. 1742 Ldy. Caroline Sackville (1718-75), dau. of 1st D. of Dorset; MP 1741-62; cr. B. Milton [I] 1753, B. Milton 1762, and E. of Dorchester 1792.	DAMER, JOSEPH	Joseph Damer
1284	DAMER, HON. LIONEL (1748-1807), 3rd s. of 1st B. Milton [I] (cr. E. of Dorchester 1792); educ. Eton and Trin. Camb. 1766; m. 1778 Williamsa Janssen; MP 1786-1802.	DAMER, HON. LIONEL	Hon. Lionel Damer
1285	DAMPIER, THOMAS (c.1704-77), s. of William Dampier of Blackford, Som.; King's Camb. 1732; fell. 1735-47; Dilettanti 1741; m. c.1746; DD 1755; lower master Eton 1745-67; canon of Windsor 1769-74; dean of Durham 1774-d.	DAMPIER, THOMAS	Thomas Dampier
1286	DANBY, WILLIAM (1752-1833), miscellaneous writer, o. s. of William Danby of Swinton Park, Yorks; Christ's Camb. 1770; suc. fa. 1781; m. 1 1775 Caroline Seymour, 2 Anne Holwell.	DANBY, WILLIAM	William Danby
1287	DANCE, GEORGE the Younger (1741-1825), architect, 5th s. of George Dance; suc. fa. 1768 as clerk of works to the City of London; founder-member RA 1768; founder-member Architects' Club 1791; Master of Merchant Taylors' Company 1794; prof. of Architecture RA 1798 (resigned 1806); FRS.	DANCE, GEORGE the Younger	George The Younger Dance
1288	DANCE, NATHANIEL (1735-1811), painter, 3rd s. of George Dance, clerk of works to the City of London; studied under Hayman; exh. FS 1764: SA 1761-2, 1766-7: RA 1769-72, 1774, 1776; m. 1783 Harriett Bisshopp; resigned from RA 1790, but exh. RA 1792, 1794 and 1800; MP 1790-1811; took name of Holland after his wife's cos. Charlotte Holland by royal licence 1800; cr. Bt. 1800.	DANCE, NATHANIEL	Nathaniel Dance
1289	DANIEL, JOHN, s. of John Daniel of Durton, Lancs; capt. in Elcho's Life Gds. and Balmerino's; escaped to France after the 1745 rebellion.	DANIEL, JOHN, s. of John Daniel of Durton, Lancs	John Daniel
1290	DANIEL	DANIEL	Daniel
1291	DANIELS, JOHN	DANIELS, JOHN	John Daniels
1292	DANSTER, MR and MRS	DANSTER, MR and MRS	Mr And Mrs Danster
1293	DARBY, GEORGE (1763-1817), see John Darby	DARBY, GEORGE	George Darby
1294	DARBY, JOHN (c.1751-90), merchant from Bristol, bro. of Mary 'Perdita' Robinson; m. Eliza - (c.1776-1837); d. Leghorn.	DARBY, JOHN	John Darby
1295	DARCY, JAMES (1707-33), o. s. of William Jessop of Bromehall, Yorks; sty. James Darcy 1721-31 when suc. gd.-fa. as 2nd B. Darcy [I]; M.Temp. 1721; Clare Camb. 1722; unm.	DARCY, JAMES	James Darcy
1296	DARCY, PATRICK, e. s. of Capt. Hyacinth Darcy of Kitulla, Gal.; M.Temple 1707; m. Anne Blake, dau. of Walter Blake of Oranmore, Gal.; Dilettanti 1735; d.s.p.	DARCY, PATRICK, e. s. of Capt. Hyacinth Darcy of Kitulla, Gal.	Patrick Darcy
1297	DARLEY	DARLEY	Darley
1298	DARNLEY, 3RD EARL OF, see Hon. John Bligh	DARNLEY, 3RD EARL OF	3rd Earl Of Darnley
1299	DARNLEY, JOHN BLIGH, 4TH EARL OF (1767-1831), e. s. of 3rd E. of Darnley [I] of Cobham Hall, Kent; educ. Eton and Ch.Ch. Oxf.; suc. fa. 1781 as 4th E.; m. 1791 Elizabeth Brownlow; FSA 1803; FRS 1810.	DARNLEY, JOHN BLIGH, 4TH EARL OF	John Bligh, 4th Earl Of Darnley
1300	DARTMOUTH, WILLIAM LEGGE, 2ND EARL OF (1731-1801), 1st surv. s. of Vct. Lewisham (d. 1732); Trin. Oxf. 1749; suc. gd.-fa. 1750 as 2nd E. of Dartmouth; FRS and FSA 1754; m. 1755 Frances Nicoll.	DARTMOUTH, WILLIAM LEGGE, 2ND EARL OF	William Legge, 2nd Earl Of Dartmouth
1301	DARTMOUTH, 3RD EARL OF, see George, Viscount Lewisham	DARTMOUTH, 3RD EARL OF	3rd Earl Of Dartmouth
1302	DASHWOOD, SIR FRANCIS, 2ND BT. (1708- 81), e. s. of Sir Francis Dashwood of West Wycombe, Bucks; educ. Eton; suc. fa. 1724 as 2nd Bt.; MP 1741-63; founder member Dilettanti 1736; m. 1745 Sarah Gould, wid. of Sir Richard Ellis; suc. via mo. 1763 as 11th B. Le Despenser; FRS 1746; FSA 1769.	DASHWOOD, SIR FRANCIS, 2ND BT.	Sir Francis, 2nd Bt. Dashwood
1303	DASHWOOD, GEORGE (d. Rome 1739; Black 1985, 131)	DASHWOOD, GEORGE	George Dashwood
1304	DASHWOOD, possibly George Dashwood (1681-1762), 2nd s. of Sir Samuel Dashwood, Kt.; Magd. Oxf. 1698; I.Temple 1697; L.Inn 1702; G.Inn 1709; MP 1703-5, 1710-13; see Joseph Addison.	DASHWOOD, possibly George Dashwood	Dashwood
1305	DASHWOOD, HENRY WATKIN (1745-1828) of Kirtlington Park, Oxon, 1st surv. s. of Sir James Dashwood, 2nd Bt.; BNC Oxf. 1763; suc. fa. 1779 as 3rd Bt.; m. 1780 Helen Graham; MP 1775-80, 1784-1820.	DASHWOOD, HENRY WATKIN	Henry Watkin Dashwood
1306	DASHWOOD, SIR JAMES, 2ND BT. (1715-79) of Kirtlington Park, Oxon., 1st surv. s. of Robert Dashwood; educ. Abingdon GS; suc. fa. 1728; suc. gd.-fa. 1734 as 2nd Bt.; m. 1739 Elizabeth Spencer; MP 1740-54, 1761-8.	DASHWOOD, SIR JAMES, 2ND BT.	Sir James, 2nd Bt. Dashwood
1307	DASHWOOD, SAMUEL (1717-94) of Well Vale, Lincs, s. of George Dashwood of Holborn and gd.-s. of Sir Samuel Dashwood, Kt.; Oriel Oxf. 1735; m. 1744 Anne Bateman.	DASHWOOD, SAMUEL	Samuel Dashwood
1308	DASHWOOD, THOMAS (1749-1825), 2nd s. of Sir James Dashwood, 2nd Bt., of Kirtlington Park, Oxon.; Univ. Coll. Oxf. 1765; m. 1782 Charlotte Auriol; EICS.	DASHWOOD, THOMAS	Thomas Dashwood
1309	DASHWOOD	DASHWOOD	Dashwood
1310	DASHWOOD, MR and MRS	DASHWOOD, MR and MRS	Mr And Mrs Dashwood
1311	DAVEL [THEODORE?], merchant.	DAVEL [THEODORE	Davel [Theodore
1312	DAVENANT, HENRY (b. 1681), s. of Dr Charles Davenant of London; Balliol Oxf. 1696; Frankfurt 1703-11; env. extra. Modena, Genoa, Parma and Florence 1714-23; m.	DAVENANT, HENRY	Henry Davenant
1313	DAVENPORT, ANDREW (d. Naples 1798); cons. Naples 1758-94.	DAVENPORT, ANDREW	Andrew Davenport
1314	DAVENPORT, DANIEL	DAVENPORT, DANIEL	Daniel Davenport
1315	DAVENPORT	DAVENPORT	Davenport
1316	DAVERS, SIR ROBERT, 5TH BT. (c.1730-63), e. s. of Sir Jermyn Davers of Rushbrooke, Suff.; suc. fa. 1743 as 5th Bt.; Trin. Camb. 1752; m. Elizabeth Hervey; murdered in N. Carolina.	DAVERS, SIR ROBERT, 5TH BT.	Sir Robert, 5th Bt. Davers
1317	DAVIES, CECILIA (c.1753?-1836), singer, called 'L'Inglesina'; dau. of a flautist; performed in Ireland, England and Europe c.1762-91.	DAVIES, CECILIA	Cecilia Davies
1318	DAVIES, MARIANNE (1744-92?), singer and instrumentalist; performed in London 1751- 67; see Cecilia Davies.	DAVIES, MARIANNE	Marianne Davies
1319	DAVINGTON, see Ogilvy 1766	DAVINGTON	Davington
1320	DAVIS, CHARLES	DAVIS, CHARLES	Charles Davis
1321	DAVIS, SIR GEORGE, 1ST BT. (d. 1705) of London, merchant; cr. Bt. 1686; cons. Naples 1672- 1702; d. Leghorn.	DAVIS, SIR GEORGE, 1ST BT.	Sir George, 1st Bt. Davis
1322	DAVIS, JOHN	DAVIS, JOHN	John Davis
1323	DAVIS, MARK	DAVIS, MARK	Mark Davis
1324	DAVIS, MRS	DAVIS, MRS	Mrs Davis
1325	DAVIS	DAVIS	Davis
1326	DAVISON, NATHANIEL, see Edward Wortley Montagu (1713-76)	DAVISON, NATHANIEL	Nathaniel Davison
1327	DAVISON, PATRICK, see Thomas Cheap	DAVISON, PATRICK	Patrick Davison
1328	DAVISON	DAVISON	Davison
1329	DAVY, DAVID	DAVY, DAVID	David Davy
1330	DAVY, ROBERT (c.1735-93), painter, b. Cullompton, Devon; drawing master in London; exh. SA 1762-64, 1766, 1770; RA 1771-82; drg. master military acad., Woolwich, 1782-93.	DAVY, ROBERT	Robert Davy
1331	DAVY	DAVY	Davy
1332	DAWKINS, JAMES (1722-57) of Laverstoke, Hants; b. Jamaica, e. s. of Henry Dawkins; St John's Oxf. 1739; suc. fa. 1744; DCL 1749; Dilettanti 1755; MP 1754-7; unm.; d. Jamaica.	DAWKINS, JAMES	James Dawkins
1333	DAWKINS, JAMES (1760-1843) of Standlynch, Wilts, e. s. of Henry Dawkins; Ch.Ch. Oxf. 1779; MP 1784-1826, 1831-2; m. 1 1785 Hannah Phipps, wid. of Charles Long, 2 Maria Forbes; Dilettanti 1787; suc. fa. 1814; took name of Colyear 1835.	DAWKINS, JAMES	James Dawkins
1334	DAWKINS, possibly James, ?1696-1766, 2nd s. of Col. Richard Dawkins of Clarendon, Jamaica; Magd. Oxf. 1713; MP 1734-47; unm.; see William, 3rd Baron Craven.	DAWKINS, possibly James,	Dawkins
1335	DAWKINS	DAWKINS	Dawkins
1336	DAWNAY, HON. JOHN (1686-1740), e. s. of 2nd Vct. Downe [I] of Cowick Hall, Yorks.; Ch.Ch. Oxf. 1703; MP 1713-16; m. 1724 Charlotte Louisa Pleydell.	DAWNAY, HON. JOHN	Hon. John Dawnay
1337	DAWNAY, JOHN (1728-80) of Cowick Hall, Yorks, 2nd s. of Hon. John Dawnay; educ. Eton and Ch.Ch. Oxf. 1745; MP 1754-74; suc. bro. 1760 as 4th Vct. Downe [I]; m. 1763 Laura Burton.	DAWNAY, JOHN	John Dawnay
1338	DAWSON, FRANCIS	DAWSON, FRANCIS	Francis Dawson
1339	DAWSON, HON. JOHN (1744-98), s. and h. of 1st Vct. Carlow [I]; educ. Eton and Trin. Camb. 1763; MP [I] 1766-71, 1776-9; Dilettanti 1778; m. 1778 Ldy. Caroline Stuart, dau. of 3rd E. of Bute [S]; suc. fa. 1779 as 2nd Vct.; cr. E. of Portarlington [I] 1785.	DAWSON, HON. JOHN	Hon. John Dawson
1340	DAWSON, THOMAS (1725-1813), 1st surv. s. of Richard Dawson of Dawson Grove, Co.Monaghan; MP [I] 1749-68; m. 1 1754 Ldy. Anne Fermor (d. 1769), dau. of 1st E. of Pomfret, 2 1770 Philadelphia Freame; cr. B. Dartrey [I] 1770, Vct. Cremorne [I] 1785, B. Cremorne 1797.	DAWSON, THOMAS	Thomas Dawson
1341	DAWSON	DAWSON	Dawson
1342	DAY, ALEXANDER (c.1751-1841), miniaturist and dealer; b. Somerset; pupil of Humphry; exh. SA 1768, 1773; m. 1792 in Rome Anna Mattei (b. c.1769).	DAY, ALEXANDER	Alexander Day
1343	DAY, JOHN 'MACGILP' (c.1736-1807), painter; occupied in preparing varnishes.	DAY, JOHN	John 'Macgilp' Day
1344	DAYLEY	DAYLEY	Dayley
1345	DEAKAN, COL., travelling in Italy with the Duke of Cumberland 1773-4 (Wal.Corr., 23:505n).	DEAKAN, COL., travelling in Italy with the Duke of Cumberland 1773-4	Col. Deakan
1346	DEAN, HUGH PRIMROSE (c.1746-84), landscape painter, b. Co. Down, 3rd s. of Alexander Dean of Donaghadee and Kinsale; m. 1761 Eleanor Gamble; exh. FS 1765 (from London); exh. SA 1766-8, 1773 (from Rome), 1780; exh. RA 1777 (from Rome), 1779, 1780 (from London).	DEAN, HUGH PRIMROSE	Hugh Primrose Dean
1347	DEARE, JOHN (1759-98), sculptor, b. Liverpool; studied with Thomas Carter in London by 1776; RA schools 1777; exh. RA 1788; m. in Rome 1791; d. Rome.	DEARE, JOHN	John Deare
1348	DE BORGH, THOMAS, Catholic Bp.	DE BORGH, THOMAS, Catholic Bp.	Thomas De Borgh
1349	DEEKER, J.	DEEKER, J.	J. Deeker
1350	DEGGE, SIMON (c.1692-1727), e. s. of Simon Degge of Derby; dir. of Soc. of Antiquaries.	DEGGE, SIMON	Simon Degge
1351	DEGGE, WILLIAM (b. 1698), 2nd s. of Simon Degge of Derby; lt.-col. of Drag.; Dilettanti 1736; see George Watkins.	DEGGE, WILLIAM	William Degge
1352	DE GREY, THOMAS (1680-1765), 1st surv. s. of William de Grey of Merton, Norf.; St John's Camb. 1697; m. by 1707 Elizabeth Windham; MP 1708-10, 1715-27.	DE GREY, THOMAS	Thomas De Grey
1353	DE GREY, THOMAS (1748-1818) of Merton, Norf., o. surv. s. of William de Grey (cr. B. Walsingham 1780); educ. Eton and Trin.Hall Camb. 1766; M.Temple 1764; m. 1772 Hon. Augusta Irby, dau. of 1st B. Boston; MP 1774- 81; FRS 1778; suc. fa. 1781 as 2nd B.; suc. uncle 1781 to Merton estates.	DE GREY, THOMAS	Thomas De Grey
1354	DELANE, SOLOMON (c.1727-1812), landscape painter, s. of Richard Delane; trained Dublin Soc. Schools under Robert West; awarded premium 1750; elected a Fellow and exh. SA 1763; exh. SA Dublin 1766; RA 1771 (from Rome), 1777 (from Rome); SA 1773, 1776 (from Rome); RA 1782-4; Parliament Ho. Dublin 1802; Hawkins St. 1812.	DELANE, SOLOMON	Solomon Delane
1355	DELAPORTE, see Philip, 2nd Earl Stanhope	DELAPORTE	Delaporte
1356	DELAVAUX	DELAVAUX	Delavaux
1357	DE LA WARR, 1ST EARL, see Hon. John West	DE LA WARR, 1ST EARL	1st Earl De La Warr
1358	DELL, J. (fl. 1793-7), sculptor; honorary exhibitor at the RA 1793-5, 1797; in 1793 exh. Portrait of an English Sculptor in Rome.	DELL, J.	J. Dell
1359	DELME, JOHN (d. 1776), 2nd. s. of Sir Peter Delmé of Rowdeford House, Wilts; Dilettanti 1736.	DELME, JOHN	John Delme
1360	DENHAM, JOSEPH (b. c.1741), merchant; m. Louisa - (b. c.1751).	DENHAM, JOSEPH	Joseph Denham
1361	DENIS, SIR PETER (1713-78) of Westerham and Blackmanstone, Kent, yr. s. of Rev. Jacob Denis, Huguenot minister; naval officer, lt.1739, capt. 1745, r.-adml. 1770, v.-adml. 1775; m. 1750 Elizabeth Heidegger, 'Miss Pappet' (d. 1765); MP 1754-68; cr. Bt. 1767.	DENIS, SIR PETER	Sir Peter Denis
1362	DENNING, JULIAN, see Charles and Robert Johnson	DENNING, JULIAN	Julian Denning
1363	DENNISON, see Joseph Mercer	DENNISON	Dennison
1364	DENNY, WILLIAM (1709-c.1770); Oriel Oxf. 1726; Dilettanti 1736; army officer; dep. gov. of Pennsylvania 1756-9.	DENNY, WILLIAM	William Denny
1365	DEREHAM, SIR THOMAS, 4TH BT. (1679- 1739), s. of Sir Richard Dereham; suc. fa. 1710 as 4th Bt.; FRS 1720; d. Rome.	DEREHAM, SIR THOMAS, 4TH BT.	Sir Thomas, 4th Bt. Dereham
1366	DERING, EDWARD (1732-98), 1st. s. of Sir Edward Dering of Surrenden Dering, Kent; educ. King's Canterbury, Westminster, and St John's Camb. 1751; m. 1 1755 Selina Furnese (d. 1757), 2 1765 Deborah Winchester; MP 1761- 70, 1774-87; Dilettanti 1761; suc. fa. 1762 as 6th Bt.	DERING, EDWARD	Edward Dering
1367	DERRY, BISHOP OF, see 4th Earl of Bristol	DERRY, BISHOP OF	Bishop Of Derry
1368	DERVAL	DERVAL	Derval
1369	DERWENTWATER, 5TH EARL OF, see Charles Radclyffe	DERWENTWATER, 5TH EARL OF	5th Earl Of Derwentwater
1370	DESART, OTWAY CUFFE, LORD (1737-1804), 2nd surv. s. of 1st B. Desart [I] of Desart, Kilkenny; Ch.Ch. Oxf. 1752; I.Temple 1756; suc. bro. 1767 as 3rd B.; m. 1785 Ldy. Anne Browne, dau. of 2nd E. of Altamont [I]; cr. Vct. Desart [I] 1781 and E. Desart [I] 1793.	DESART, OTWAY CUFFE, LORD	Otway Cuffe, Lord Desart
1371	DESKFORD, JAMES OGILVY, LORD (c.1714- 70), e. s. of 5th E. of Findlater [S] and 2nd E. of Seafield [S], of Cullen House, Banff; sty. Ld. Deskford 1730-64 when suc. fa. as 6th E. and 3rd E.; m. 1749 Ldy. Mary Murray, dau. of 1st D. of Atholl [S]; d. by own hand.	DESKFORD, JAMES OGILVY, LORD	James Ogilvy, Lord Deskford
1372	DEVAERE JOHN (1755-1830), designer and modeller; b. Ghent; RA Schools 1786-; working for Wedgwood from 1787.	DEVAERE JOHN	Devaere John
1373	DEVENISH, CHARLES (1700-c.1750), s. of Edward Devenish of Dublin; Trin. Dublin 1716.	DEVENISH, CHARLES	Charles Devenish
1374	DEVISME, LOUIS (1720-77), diplomat, 3rd s. of Phillippe de Visme, a Huguenot; Ch.Ch. Oxf. 1739; ord.; sec. Madrid 1763-7, St Petersburg 1768-9; min.plen. Bavaria 1770-74; env.extra. Stockholm 1773-6.	DEVISME, LOUIS	Louis Devisme
1375	DEVONSHIRE, GEORGIANA (SPENCER), DUCHESS OF (1757-1806), 1st dau. of 1st E. Spencer; m. 1774 5th D. of Devonshire.	DEVONSHIRE, GEORGIANA	Georgiana Devonshire
1376	DEVONSHIRE, 4TH DUKE OF, see William, Marquess of Hartington	DEVONSHIRE, 4TH DUKE OF	4th Duke Of Devonshire
1377	DEVONSHIRE, WILLIAM CAVENDISH, 5TH DUKE OF (1748-1811), e. s. of 4th D. of Devonshire; suc. mo. 1754 as Ld. Clifford; sty. M. of Hartington -1764 when suc. fa. as 5th D.; m. 1 1774 Ldy. Georgiana Spencer (d. 1806), dau. of 1st E.Spencer, 2 1809 Ldy. Elizabeth Hervey, dau. of 4th E. of Bristol, wid. of J.T. Foster; KG 1782.	DEVONSHIRE, WILLIAM CAVENDISH, 5TH DUKE OF	William Cavendish, 5th Duke Of Devonshire
1378	DEWES, COURT (1742-93), e. s. of John Dewes of Wellesbourne, War (d. 1780); suc. uncle 1775 to Granville estates, later took name Granville; see Edmund Dewes.	DEWES, COURT	Court Dewes
1379	DEWES, EDMUND, manservant to Court Dewes (1742-93) of Wellesbourne, War.	DEWES, EDMUND, manservant to Court Dewes	Edmund Dewes
1380	DEWITT	DEWITT	Dewitt
1381	DICCONSON, HUGH	DICCONSON, HUGH	Hugh Dicconson
1382	DICK, SIR ALEXANDER, see Alexander Cunyngham	DICK, SIR ALEXANDER	Sir Alexander Dick
1383	DICK, MRS ISABELLA	DICK, MRS ISABELLA	Mrs Isabella Dick
1384	DICK, SIR JOHN (1719-1804), 1st surv. s. of Andrew Dick of Newcastle; m. c.1740 Anne Bragg (1720-81); cons. Leghorn 1754-76; suc. 1768 as 5th Bt. Dick of Braid ; FSA Scot. 1784.	DICK, SIR JOHN	Sir John Dick
1385	DICKENS, [ROBERT?]	DICKENS, [ROBERT	[Robert Dickens
1386	DICKINS, possibly Francis Dickins, 1750- 1833, of Wollaston, Northants, and Branches Park, Suff., o. s. of Ambrose Dickins; educ. Westminster and Trin.Hall Camb. 1767; m. 1778 Hon.Diana Manners Sutton, dau. of Ld. George Manners Sutton; MP 1788-1806.	DICKINS, possibly Francis Dickins, 1750- 1833, of Wollaston, Northants, and Branches Park, Suff., o. s. of Ambrose Dickins	Dickins
1387	DICKSON, WILLIAM	DICKSON, WILLIAM	William Dickson
1388	DICKTON, see Henry Cotton	DICKTON	Dickton
1389	DIGBY, EDWARD (1730-57), 1st s. of the Hon. Edward Digby; educ. Westminster and Magd. Oxf. 1747; suc. gd.-fa. 1752 as 6th B. Digby [I]; MP 1751-d.; unm.	DIGBY, EDWARD	Edward Digby
1390	DIGBY, EDWARD DIGBY, 2ND EARL OF (1773-1856), 1st surv. s. of 1st E. of Digby; sty. Vct. Coleshill 1790-93 when suc. fa. as 2nd E.; Ch.Ch. Oxf. 1790; unm.	DIGBY, EDWARD DIGBY, 2ND EARL OF	Edward Digby, 2nd Earl Of Digby
1391	DIGBY, HON. JOHN (d. 1717), 1st s. of 5th B. Digby [I]; Magd. Oxf. 1703 [?]; unm.	DIGBY, HON. JOHN	Hon. John Digby
1392	DIGBY, KENELM (1754-1812), s. of Hon. Wriothesley Digby (4th s. of 5th B. Digby [I]).	DIGBY, KENELM	Kenelm Digby
1393	DIGBY, see Henry Willoughby	DIGBY	Digby
1394	DIGGES, CAPT. DUDLEY (d. 1779); naval officer, lt. 1740, capt. 1753; see Nest Digges.	DIGGES, CAPT. DUDLEY	Capt. Dudley Digges
1395	DIGGES, NEST, possibly the comedian West Digges, 1720-86.	DIGGES, NEST, possibly the comedian West Digges, 1720-86.	Nest Digges
1396	DIGGES, J., possibly John Digges, c.1687- 1720, 1st s. of Leonard Digges of Chilham Castle, Kent.	DIGGES, J., possibly John Digges, c.1687- 1720, 1st s. of Leonard Digges of Chilham Castle, Kent.	J. Digges
1397	DIHARCE, PETER (1707-after 1757), Catholic merchant at Leghorn; capt. of the Port of Leghorn 1744-57; sea consul at Pisa 1757; ennobled 1744 (Wal.Corr., 20:421n18).	DIHARCE, PETER	Peter Diharce
